{
  "schemaVersion": "1.0",
  "baselineVersion": "1.0.0",
  "definitionType": "BaselineIndex",
  "name": "DER Baseline Object Index",
  "immutable": true,
  "definitions": [
    {
      "derId": "DER-ANALYTICS-010",
      "module": "Analytics",
      "objectType": "EndpointAnalyticsSettings",
      "action": "Configure",
      "safeState": "Pilot device group only",
      "productionBehavior": "PilotOnly",
      "ownershipOnCreate": "DER-Owned"
    },
    {
      "derId": "DER-AP-010",
      "module": "Autopilot",
      "objectType": "AutopilotProfile",
      "action": "Create",
      "safeState": "Assigned only to DER Autopilot group",
      "productionBehavior": "PilotOnly",
      "ownershipOnCreate": "DER-Owned"
    },
    {
      "derId": "DER-AP-030",
      "module": "Autopilot",
      "objectType": "AutopilotProfile",
      "action": "Create",
      "safeState": "Assigned only to empty DER self-deploying group",
      "productionBehavior": "PilotOnly",
      "ownershipOnCreate": "DER-Owned"
    },
    {
      "derId": "DER-ASR-010",
      "module": "ASR",
      "objectType": "EndpointSecurityPolicy",
      "action": "Create",
      "safeState": "Audit-first/Pilot",
      "productionBehavior": "PilotOnly",
      "ownershipOnCreate": "DER-Owned"
    },
    {
      "derId": "DER-ASR-020",
      "module": "ASR",
      "objectType": "EndpointSecurityPolicy",
      "action": "Create",
      "safeState": "Audit",
      "productionBehavior": "PilotOnly",
      "ownershipOnCreate": "DER-Owned"
    },
    {
      "derId": "DER-ASR-030",
      "module": "ASR",
      "objectType": "EndpointSecurityPolicy",
      "action": "Create",
      "safeState": "Audit",
      "productionBehavior": "PilotOnly",
      "ownershipOnCreate": "DER-Owned"
    },
    {
      "derId": "DER-AUTH-010",
      "module": "AuthenticationMethods",
      "objectType": "AuthenticationMethodsPolicy",
      "action": "Configure",
      "safeState": "Pilot/scoped where supported",
      "productionBehavior": "PilotOnly",
      "ownershipOnCreate": "DER-Owned"
    },
    {
      "derId": "DER-BL-010",
      "module": "BitLocker",
      "objectType": "EndpointSecurityPolicy",
      "action": "Create",
      "safeState": "Pilot only",
      "productionBehavior": "PilotOnly",
      "ownershipOnCreate": "DER-Owned"
    },
    {
      "derId": "DER-CAP-010",
      "module": "ConditionalAccess",
      "objectType": "ConditionalAccessPolicy",
      "action": "Create",
      "safeState": "Report-only",
      "productionBehavior": "ReportOnly",
      "ownershipOnCreate": "DER-Owned"
    },
    {
      "derId": "DER-CAP-020",
      "module": "ConditionalAccess",
      "objectType": "ConditionalAccessPolicy",
      "action": "Create",
      "safeState": "Report-only",
      "productionBehavior": "ReportOnly",
      "ownershipOnCreate": "DER-Owned"
    },
    {
      "derId": "DER-CAP-030",
      "module": "ConditionalAccess",
      "objectType": "ConditionalAccessPolicy",
      "action": "Create",
      "safeState": "Report-only",
      "productionBehavior": "ReportOnly",
      "ownershipOnCreate": "DER-Owned"
    },
    {
      "derId": "DER-CAP-040",
      "module": "ConditionalAccess",
      "objectType": "ConditionalAccessPolicy",
      "action": "Create",
      "safeState": "Report-only",
      "productionBehavior": "ReportOnly",
      "ownershipOnCreate": "DER-Owned"
    },
    {
      "derId": "DER-CAP-050",
      "module": "ConditionalAccess",
      "objectType": "ConditionalAccessPolicy",
      "action": "Create",
      "safeState": "Report-only",
      "productionBehavior": "ReportOnly",
      "ownershipOnCreate": "DER-Owned"
    },
    {
      "derId": "DER-CAP-060",
      "module": "ConditionalAccess",
      "objectType": "ConditionalAccessPolicy",
      "action": "Create",
      "safeState": "Report-only",
      "productionBehavior": "ReportOnly",
      "ownershipOnCreate": "DER-Owned"
    },
    {
      "derId": "DER-CAP-070",
      "module": "ConditionalAccess",
      "objectType": "ConditionalAccessPolicy",
      "action": "Create",
      "safeState": "Report-only",
      "productionBehavior": "ReportOnly",
      "ownershipOnCreate": "DER-Owned"
    },
    {
      "derId": "DER-CAP-080",
      "module": "ConditionalAccess",
      "objectType": "ConditionalAccessPolicy",
      "action": "Create",
      "safeState": "Report-only",
      "productionBehavior": "ReportOnly",
      "ownershipOnCreate": "DER-Owned"
    },
    {
      "derId": "DER-CAP-090",
      "module": "ConditionalAccess",
      "objectType": "ConditionalAccessPolicy",
      "action": "Create",
      "safeState": "Report-only",
      "productionBehavior": "ReportOnly",
      "ownershipOnCreate": "DER-Owned"
    },
    {
      "derId": "DER-CAP-100",
      "module": "ConditionalAccess",
      "objectType": "ConditionalAccessPolicy",
      "action": "Create",
      "safeState": "Report-only",
      "productionBehavior": "ReportOnly",
      "ownershipOnCreate": "DER-Owned"
    },
    {
      "derId": "DER-CAP-110",
      "module": "ConditionalAccess",
      "objectType": "ConditionalAccessPolicy",
      "action": "Create",
      "safeState": "Report-only",
      "productionBehavior": "ReportOnly",
      "ownershipOnCreate": "DER-Owned"
    },
    {
      "derId": "DER-CAP-120",
      "module": "ConditionalAccess",
      "objectType": "ConditionalAccessPolicy",
      "action": "Create",
      "safeState": "Report-only",
      "productionBehavior": "ReportOnly",
      "ownershipOnCreate": "DER-Owned"
    },
    {
      "derId": "DER-CFG-010",
      "module": "Configuration",
      "objectType": "SettingsCatalogPolicy",
      "action": "Configure",
      "safeState": "Pilot only",
      "productionBehavior": "PilotOnly",
      "ownershipOnCreate": "DER-Owned"
    },
    {
      "derId": "DER-CFG-020",
      "module": "OneDrive",
      "objectType": "SettingsCatalogPolicy",
      "action": "Create",
      "safeState": "Pilot device group",
      "productionBehavior": "PilotOnly",
      "ownershipOnCreate": "DER-Owned"
    },
    {
      "derId": "DER-CFG-030",
      "module": "Configuration",
      "objectType": "SettingsCatalogPolicy",
      "action": "Configure",
      "safeState": "Pilot only",
      "productionBehavior": "PilotOnly",
      "ownershipOnCreate": "DER-Owned"
    },
    {
      "derId": "DER-COMP-010",
      "module": "Compliance",
      "objectType": "CompliancePolicy",
      "action": "Create",
      "safeState": "Pilot only",
      "productionBehavior": "PilotOnly",
      "ownershipOnCreate": "DER-Owned"
    },
    {
      "derId": "DER-CONSENT-010",
      "module": "AppConsent",
      "objectType": "AdminConsentRequestPolicy",
      "action": "Configure",
      "safeState": "Reviewers required",
      "productionBehavior": "NoAssignment",
      "ownershipOnCreate": "DER-Adopted"
    },
    {
      "derId": "DER-DO-010",
      "module": "DeliveryOptimization",
      "objectType": "DeliveryOptimizationConfiguration",
      "action": "Create",
      "safeState": "Pilot device group",
      "productionBehavior": "PilotOnly",
      "ownershipOnCreate": "DER-Owned"
    },
    {
      "derId": "DER-ENR-010",
      "module": "Enrollment",
      "objectType": "EnrollmentRestriction",
      "action": "Create",
      "safeState": "Enrollment Users group only",
      "productionBehavior": "PilotOnly",
      "ownershipOnCreate": "DER-Owned"
    },
    {
      "derId": "DER-ENR-020",
      "module": "Enrollment",
      "objectType": "EnrollmentLimit",
      "action": "Create",
      "safeState": "Enrollment Users group only",
      "productionBehavior": "PilotOnly",
      "ownershipOnCreate": "DER-Owned"
    },
    {
      "derId": "DER-ENTRA-010",
      "module": "EntraDevice",
      "objectType": "DeviceRegistrationPolicy",
      "action": "Configure",
      "safeState": "Explicit approval required",
      "productionBehavior": "ExplicitApproval",
      "ownershipOnCreate": "DER-Adopted"
    },
    {
      "derId": "DER-ESP-010",
      "module": "Autopilot",
      "objectType": "EnrollmentStatusPage",
      "action": "Create",
      "safeState": "Assigned only to DER Autopilot group",
      "productionBehavior": "PilotOnly",
      "ownershipOnCreate": "DER-Owned"
    },
    {
      "derId": "DER-FU-010",
      "module": "Updates",
      "objectType": "FeatureUpdatePolicy",
      "action": "Create",
      "safeState": "Pilot group",
      "productionBehavior": "PilotOnly",
      "ownershipOnCreate": "DER-Owned"
    },
    {
      "derId": "DER-FU-020",
      "module": "Updates",
      "objectType": "FeatureUpdatePolicy",
      "action": "Create",
      "safeState": "Empty Production group",
      "productionBehavior": "EmptyProductionTarget",
      "ownershipOnCreate": "DER-Owned"
    },
    {
      "derId": "DER-FW-010",
      "module": "Firewall",
      "objectType": "EndpointSecurityPolicy",
      "action": "Create",
      "safeState": "Pilot only",
      "productionBehavior": "PilotOnly",
      "ownershipOnCreate": "DER-Owned"
    },
    {
      "derId": "DER-GRP-D-010",
      "module": "Groups",
      "objectType": "SecurityGroup",
      "action": "Create",
      "safeState": "Assigned/dynamic group only",
      "productionBehavior": "NoAssignment",
      "ownershipOnCreate": "DER-Owned"
    },
    {
      "derId": "DER-GRP-D-020",
      "module": "Groups",
      "objectType": "SecurityGroup",
      "action": "Create",
      "safeState": "Assigned/dynamic group only",
      "productionBehavior": "NoAssignment",
      "ownershipOnCreate": "DER-Owned"
    },
    {
      "derId": "DER-GRP-D-100",
      "module": "Groups",
      "objectType": "SecurityGroup",
      "action": "Create",
      "safeState": "Assigned/dynamic group only",
      "productionBehavior": "NoAssignment",
      "ownershipOnCreate": "DER-Owned"
    },
    {
      "derId": "DER-GRP-D-110",
      "module": "Groups",
      "objectType": "SecurityGroup",
      "action": "Create",